順位,商品名,価格,店舗名,商品コード,itemUrl,レビュー数
1,セントー ショコラティエのアイスアソート ギフト 贈り物 送料無料【産直】[24],10674,本家屋,honkeya:10884564,https://item.rakuten.co.jp/honkeya/211016466-24-4820-472/?rafcid=wsc_i_is_1023124763673215282,0
2,"1,050円お得！18ケ入り×2箱(パック詰め)",7050,大みか饅頭の運平堂本店,unpeido:10000257,https://item.rakuten.co.jp/unpeido/p3-06wnx2_2022/?rafcid=wsc_i_is_1023124763673215282,0
3,くるみ お菓子 塩くるみ黒糖 120g 5袋セット 沖縄県産 さとうきび 黒糖 菓子 持ち歩き ナッツ おやつ クルミ 胡桃 青い海 海水塩 金城黒糖,2600,沖縄健康食品Webショップ,okiken:10003474,https://item.rakuten.co.jp/okiken/kk-shiokurumix05/?rafcid=wsc_i_is_1023124763673215282,0
4,【ふるさと納税】宇治の茶団子12本と米粉のもちもちどら焼き(抹茶きな粉餡)10個 | 西宮 老舗和菓子店 宇治抹茶使用 米粉生地 和菓子詰合せ 人気 おすすめ 茶団子 どら焼き 抹茶 きなこ ギフト お取り寄せ 通販 送料無料 ふるさと納税,14000,兵庫県西宮市,f282049-nishinomiya:10000689,https://item.rakuten.co.jp/f282049-nishinomiya/eq002/?rafcid=wsc_i_is_1023124763673215282,0
5,全珍 4枚姿フライ [1箱 10個入] 【いか お菓子 駄菓子 おつまみ まとめ買い】,1078,ミカミオンラインショップ,3upmikami:10006382,https://item.rakuten.co.jp/3upmikami/4973508914109-m/?rafcid=wsc_i_is_1023124763673215282,0
6,【メール便送料無料】コリス ドラゴンボール超ガム コーラ味 1枚入り×55個+当たり分5個(計60個),1340,N丁目薬品,n-yakuhin:10004284,https://item.rakuten.co.jp/n-yakuhin/4901361001063-55nki/?rafcid=wsc_i_is_1023124763673215282,0
7,寒づくりいよかんゼリー12個入り,4800,愛媛みかんの「のま果樹園」,kajuen:10008186,https://item.rakuten.co.jp/kajuen/190062/?rafcid=wsc_i_is_1023124763673215282,0
8,抹茶きなこ飴（80g（個包装込み））【純正食品マルシマ】□,443,お〜がにっくしぜんかん,shizenkan-genki:10036809,https://item.rakuten.co.jp/shizenkan-genki/sk161769/?rafcid=wsc_i_is_1023124763673215282,0
9,無双本葛100％ ムソー,764,marche du monde 世界のマルシェ,sekamaru:10007044,https://item.rakuten.co.jp/sekamaru/muso-honkuzu-110-1/?rafcid=wsc_i_is_1023124763673215282,0
10,（CSA-S）メリーチョコレート　カカオサブレアソート,3240,山形屋,yamakataya:10053600,https://item.rakuten.co.jp/yamakataya/25aw252341/?rafcid=wsc_i_is_1023124763673215282,0
11,Stur - 液体ウォーターエンハンサーフレッシュフルーツパンチ - 1.62 fl。オズ。 Stur - Liquid Water Enhancer Freshly Fruit Punch - 1.62 fl. oz.,3061,Glomarket,glomarket:11095692,https://item.rakuten.co.jp/glomarket/11095692/?rafcid=wsc_i_is_1023124763673215282,0
12,フレンズクレープ　みかん　35g　1個　アレルギー配慮　学校給食デザート　冷凍スイーツ 卵・乳・小麦不使用 専用工場 国産米粉 国産大豆 自家製豆乳 ミカン 蜜柑 フルーツ 果物,98,PASSIOS（パシオズ）,koukyourin:10002126,https://item.rakuten.co.jp/koukyourin/frozen101/?rafcid=wsc_i_is_1023124763673215282,0
13,《セット販売》　和歌山産業 蔵王高原農園 いつものナタデココ (120g)×10個セット ナタデココシロップ漬け デザート お菓子　※軽減税率対象商品,1296,ドラッグストアウェルネス,wellness-web:10160735,https://item.rakuten.co.jp/wellness-web/10170148/?rafcid=wsc_i_is_1023124763673215282,0
14,コンビネーションギフト ベイクドスイーツセレクション&今治タオルセット (MJ3-BT2),6886,イースクエア,e-squ:14104095,https://item.rakuten.co.jp/e-squ/bn000003757/?rafcid=wsc_i_is_1023124763673215282,0
15,送料無料 お歳暮 お中元 贈答用 引出物 果実ゼリー詰め合わせ 8パック（ラ・フランス・佐藤錦・甘夏・ぶどう・パイン・マンゴ・みかん・三種果実）,5500,いりえフルーツ,iriefruts:10000129,https://item.rakuten.co.jp/iriefruts/10000129/?rafcid=wsc_i_is_1023124763673215282,0
16,EX ゆずシャーベット 2000ml 森永乳業 アイスクリーム,2475,業務用製菓材料のスイートキッチン,kashizairyo:10109983,https://item.rakuten.co.jp/kashizairyo/48547/?rafcid=wsc_i_is_1023124763673215282,0
17,【送料無料ポスト投函F】希少糖入り芋けんぴ420g (210g×2) 小分け ｜ さつまいも いもけんぴ けんぴ かりんとう おやつ お菓子 お茶請け 黄金千貫 希少糖 スイーツ 和菓子 ギフト お礼 セット 粗品 お配り プチギフト ポイント消化 買いまわり 買い回り,1490,健康日和,tennenlife:10002116,https://item.rakuten.co.jp/tennenlife/snc00010135/?rafcid=wsc_i_is_1023124763673215282,0
18,【6個購入で1個多くおまけ】【楽天倉庫直送】香ばしい皮と甘さ控えめ餡子が絶妙!!【お徳用】ひとくち最中 600g(200g×3袋)【ヘルシ価格】,1990,ヘルシー救急BOX,parusu:11154471,https://item.rakuten.co.jp/parusu/ten-s178-4573186216719-mom2101/?rafcid=wsc_i_is_1023124763673215282,0
19,"BLUEGREEN BLUE GREEN ORGANICS, Agave syrup, Agave gallon, Agave, Gluten Free, Organic, Sweetener, fruit, teas, coffees, pancakes or any baked good, Family-friendly, Sugar substitute, Raw, 176 Oz",20432,Glomarket,glomarket:11101935,https://item.rakuten.co.jp/glomarket/11101935/?rafcid=wsc_i_is_1023124763673215282,0
20,いちご割れチョコ　ヒルゼンミルキー,540,あいたいよう楽天市場店,i-taiyou:10000128,https://item.rakuten.co.jp/i-taiyou/10000128/?rafcid=wsc_i_is_1023124763673215282,0
21,【お買上特典】ふっくりんこJAPON・白米 小魚ケール味 14g（約10枚） 【澤田米穀店】,230,健康サポート専門店,kenkousupport:10057362,https://item.rakuten.co.jp/kenkousupport/0038-0-33448/?rafcid=wsc_i_is_1023124763673215282,0
22,【直送品】【6個セット】パチボールラムネ ドリンクアソート 60gx6個セット 食品 スイーツ お菓子 駄菓子 ラムネ,1681,ヘルシー救急BOX,parusu:11499200,https://item.rakuten.co.jp/parusu/sinnni881r6-4902124682109-r5/?rafcid=wsc_i_is_1023124763673215282,0
23,自家挽きアーモンドのガトーセレクション(24個) 184 (-0386-071-) | 内祝い ギフト 出産内祝い 引き出物 結婚内祝い 快気祝い お返し 志,3224,まごころギフトたばき,magokorotabaki:10658783,https://item.rakuten.co.jp/magokorotabaki/sd-gg-801292/?rafcid=wsc_i_is_1023124763673215282,0
24,グラシア　ペアサーモタンブラー(GL・SI)　ブライダル 記念品 引き出物 内祝い 内祝 プチギフト 縁起物 お祝い 御祝 快気祝い,2683,贈り物専門店ココイロギフト,cococara:10362612,https://item.rakuten.co.jp/cococara/gr-1660/?rafcid=wsc_i_is_1023124763673215282,0
25,しっとり焼き干し芋 150g×1袋＆しっとり甘い干し芋 52g×2袋 計3袋詰め合わせセット 干しいも やわらかい スティック 自然な甘み まろやか 和菓子 スイーツ さつまいも 笑顔 壮関【メール便送料無料】,1080,みどり商店,midorisyoten:10004611,https://item.rakuten.co.jp/midorisyoten/228-010-042-3ma/?rafcid=wsc_i_is_1023124763673215282,0
26,明治産業 パチパチパニック (グレープ) 5g×20袋 アレンジ 箱買い 明治産業 asmr 駄菓子 コーラ味 ソーダ味 グレープ 大容量 大容量 ポッピングシャワー 人気 縁日 子ども会 町内会 景品 ASMR 飴 キャンディ 駄菓子 懐かしい,1040,SevenRabbitRiogrande,7r-riogrande:10002571,https://item.rakuten.co.jp/7r-riogrande/mail-250g-0023/?rafcid=wsc_i_is_1023124763673215282,0
27,"ジェリーベリー グミ ペット タランチュラ、1.5 オンス、24 パック Jelly Belly Gummi Pet Tarantula, 1.5-oz, 24 Pack",26260,Glomarket,glomarket:10531392,https://item.rakuten.co.jp/glomarket/10531392/?rafcid=wsc_i_is_1023124763673215282,0
28,【ふるさと納税】サブレ6種詰め合わせBOX お菓子 スイーツ セット ギフト 手作り ふるさと納税 クッキー サブレ 詰め合わせ,21000,大阪府泉南市,f272281-sennan:10001406,https://item.rakuten.co.jp/f272281-sennan/10001392/?rafcid=wsc_i_is_1023124763673215282,0
29,(地域限定送料無料) 業務用 ロッテ ベーシック バリューチョコレート 4L 3コ入り (冷凍)(590021684ck),15120,さんきゅーマーチ,39march:10014043,https://item.rakuten.co.jp/39march/590021684ck/?rafcid=wsc_i_is_1023124763673215282,0
30,"フィラデルフィア キャンディーズ ラズベリー メルタウェイ トリュフ、ダーク チョコレート 1 ポンド ギフト ボックス Philadelphia Candies Raspberry Meltaway Truffles, Dark Chocolate 1 pound Gift Box",11193,Glomarket,glomarket:10344548,https://item.rakuten.co.jp/glomarket/10344548/?rafcid=wsc_i_is_1023124763673215282,0
31,【あわせ買い2999円以上で送料お得】カイゲンファーマ 改源 梅のど飴 70g,367,ホームライフ,kaigo:10261461,https://item.rakuten.co.jp/kaigo/103-4987040912370/?rafcid=wsc_i_is_1023124763673215282,0
32,"【アメリカウォルマート品】トスティトス カンティーナ トルティーヤチップス シン＆クリスプ 425.2g Tostitos Cantina Thin and Crispy Tortilla Chips, Party Size, 15 oz Bag 【お取り寄せ商品】【合わせて買いたい】",1572,カリフォルニアスマイル,cmga:10012780,https://item.rakuten.co.jp/cmga/wm-22988/?rafcid=wsc_i_is_1023124763673215282,0
33,"ベアベイククランチアップルチップス、グラニースミス、グルテンフリー、3.4オンス袋、6個入り Bare Baked Crunchy Apple Chips, Granny Smith, Gluten Free, 3.4 Ounce Bag, 6 Count",10339,Glomarket,glomarket:10006169,https://item.rakuten.co.jp/glomarket/10006169/?rafcid=wsc_i_is_1023124763673215282,0
34,プリングラッセ チーズ カラメル なめらか スフレ テリーヌ スイーツ 洋菓子 ホワイトデー お返し プレゼント ギフト 送料無料,6200,おとなの週末　お取り寄せ倶楽部,otoshuclub:10004280,https://item.rakuten.co.jp/otoshuclub/8502032/?rafcid=wsc_i_is_1023124763673215282,0
35,臥龍鍋巴(爆辣味) 【3点セット】激辛おこげ 中国の米料理の一つである おつまみ 軽食 200g×3点,1690,東洋ツバメの巣,yanwo:10002111,https://item.rakuten.co.jp/yanwo/28gb-bl-3-wl/?rafcid=wsc_i_is_1023124763673215282,0
36,和 フィナンシェ 18個 焼菓子 お菓子 スイーツ ギフト 新築内祝い 両親 お返し 職場 半返し ママ友 身内 品物 快気祝い 快気内祝い 就職祝い お見舞い お返し 退院祝い お礼 プレゼント 50代 お供え 通販 還暦 古希 (SD) 軽 5000円 香典返し 七五三 誕生日,4400,お返しギフトと内祝いのアイプレ,i-preshop2:10002431,https://item.rakuten.co.jp/i-preshop2/17-0462-120-2/?rafcid=wsc_i_is_1023124763673215282,0
37,大阪京菓 ZRxカルビー　105G クリスプうましお味×24個【xwa5】【送料無料（沖縄は別途送料）】,7838,大阪京菓楽天市場店,osaka:10378416,https://item.rakuten.co.jp/osaka/4901330621032xw/?rafcid=wsc_i_is_1023124763673215282,0
38,ディズニー　吸水速乾タオルギフトセットミッキー 贈答品 ギフト 贈り物,7350,Shop-Polori 楽天市場店,polori:10039084,https://item.rakuten.co.jp/polori/shaddy-25-0148-073/?rafcid=wsc_i_is_1023124763673215282,0
39,2セットでお届け　くつろぎの時間 カフェスウィーツアソート BCT-BE【北海道・沖縄県・離島 配送不可】,3830,産直お取り寄せニッポンセレクト,nipponselect:10206809,https://item.rakuten.co.jp/nipponselect/g000425050049/?rafcid=wsc_i_is_1023124763673215282,0
40,まとめ買い 創健社 ポテトチップス うす塩味 60g 20袋セット 国産ジャガイモ100%使用 植物油使用 海水塩使用 おやつ 安心 安全☆★,4350,Webby,webby:14657240,https://item.rakuten.co.jp/webby/50863392/?rafcid=wsc_i_is_1023124763673215282,0
41,【最大2000円OFFクーポン】BIGS クラックドペッパーサンフラワーシード ケトフレンドリースナック 5.35オンス袋（12個パック）BIGS Cracked Pepper Sunflower Seeds Keto Friendly Snack 5.35-oz. Bag (Pack of 12) 【お取り寄せ商品】【合わせて買いたい】,7344,Costopa,womensfitness:10026763,https://item.rakuten.co.jp/womensfitness/zy-14501/?rafcid=wsc_i_is_1023124763673215282,0
42,【LINE登録で300円クーポン】カルシウムバー カルシウム 60枚 1本 お菓子 おやつ スナック菓子 バー おやつ 送料無料,2960,美味セレクト楽天市場店,shopk-net:10000385,https://item.rakuten.co.jp/shopk-net/sm00010244/?rafcid=wsc_i_is_1023124763673215282,0
43,落花生巻き(20本入) ピーナッツ ナッツ 落花生 焼き菓子 クッキー お菓子 おやつ 美味しい 人気 おすすめ ギフト お土産 プレゼント 贈り物 お返し 国産 プチギフト 手土産 贈答品 お礼 千葉 房総 特産品 地域限定 ご当地 お取り寄せ,1840,ヤマトサカナ,yamatosakana:10000173,https://item.rakuten.co.jp/yamatosakana/tom013/?rafcid=wsc_i_is_1023124763673215282,0
44,ギフト 贈り物 ティサージュ ミルフィーユ TM-10 内祝 御祝 御礼 プレゼント,1620,マルヒロWEBショップ,maruhiro-web:10029522,https://item.rakuten.co.jp/maruhiro-web/68400040/?rafcid=wsc_i_is_1023124763673215282,0
45,【ポイント5倍】烏鶏庵 烏骨鶏かすていら＆バームクーヘン詰合せ（木箱入）【結婚内祝い 引出物 寿 引き出物 新築内祝い 出産内祝い 内祝い お祝い お祝い返し ギフト 出産祝い お返し 返礼 快気祝 御挨拶】【御歳暮 お歳暮 寒中御見舞】【送料無料 送料込み】,13620,内祝いギフト専門店AGERU,ageru:10003035,https://item.rakuten.co.jp/ageru/706063c/?rafcid=wsc_i_is_1023124763673215282,0
46,【メール便送料無料】杉本屋製菓 まけんグミ サイダー味 15g入×20個セット＜じゃんけんぽんグミ＞(※プレゼントキャンペーンは終了している場合がございます),1369,N丁目薬品,n-yakuhin:10010109,https://item.rakuten.co.jp/n-yakuhin/4901818155196-20nki/?rafcid=wsc_i_is_1023124763673215282,0
47,【送料無料】★まとめ買い★　西村　ベビッコ　5連　×15個【イージャパンモール】,3157,イージャパンアンドカンパニーズ,japan-ds:12126817,https://item.rakuten.co.jp/japan-ds/015-4904073888823tm/?rafcid=wsc_i_is_1023124763673215282,0
48,【黒豆ものがたり】と-21　黒豆菓子　4箱入,2350,京の黒豆　北尾,kitaoshoji:10000411,https://item.rakuten.co.jp/kitaoshoji/to-21/?rafcid=wsc_i_is_1023124763673215282,0
49,【あわせ買い2999円以上で送料お得】養命酒製造 クロモジ のど飴 和みミント 76g,381,ホームライフ,kaigo:10325595,https://item.rakuten.co.jp/kaigo/103-4987236019135/?rafcid=wsc_i_is_1023124763673215282,0
50,大阪京菓 ZRx正栄デリシィ　78G 大人のクランチ薫るクッキー＆クリーム×112個【xra5】【送料無料（沖縄は別途送料）】,43765,大阪京菓楽天市場店,osaka:10366387,https://item.rakuten.co.jp/osaka/4580346093325xra5/?rafcid=wsc_i_is_1023124763673215282,0
51,金城製菓 ミックスゼリー 115g×10袋,3302,菓子の新商品はポイポイマーケット,poipoimarket:10053708,https://item.rakuten.co.jp/poipoimarket/t04901324016660/?rafcid=wsc_i_is_1023124763673215282,0
52,井村屋 レンジで簡単ぜんざい＆壮関 国産 紅はるか 干し芋 計4袋 詰め合わせセット【メール便送料無料】,1130,みどり商店,midorisyoten:10002580,https://item.rakuten.co.jp/midorisyoten/228-010-043-4mb/?rafcid=wsc_i_is_1023124763673215282,0
53,三立製菓 お徳用平家パイ　12枚×3,1347,カウモール,kaumall:10454895,https://item.rakuten.co.jp/kaumall/70330069/?rafcid=wsc_i_is_1023124763673215282,0
54,【ふるさと納税】岡山備中大納言小豆と栗を包み込んだ手焼きの銘菓子『やまんぼう』3本入り,13000,岡山県井原市,f332071-ibara:10000338,https://item.rakuten.co.jp/f332071-ibara/80-01/?rafcid=wsc_i_is_1023124763673215282,0
55,大阪京菓 ZRxクラシエフーズ　42G ねりキャンワールド×168個【xwa5】【送料無料（沖縄は別途送料）】,53599,大阪京菓楽天市場店,osaka:10364186,https://item.rakuten.co.jp/osaka/4901551357215xw/?rafcid=wsc_i_is_1023124763673215282,0
56,あまおう苺ラングドシャ ホワイトショコラ×8 ショコラ×8 福岡県産あまおうを使用したいちごピューレを練り込んだサクサクのラングドシャクッキー GT20 食品 佃煮 詰合せ セット ギフト | 関連単語 バラエティー 缶詰 調味料 お茶 昆布 バラエティ セット,5850,創造生活館,ssk-1:19721011,https://item.rakuten.co.jp/ssk-1/asve-214854_10-/?rafcid=wsc_i_is_1023124763673215282,0
57,【2％OFFクーポン配布中 対象商品限定】【I210】【メール便で送料無料 ※定形外発送の場合あり】味覚糖株式会社コグミ 85g×10個セット【RCP】,1939,ドラッグピュア楽天市場店,drugpure:10293150,https://item.rakuten.co.jp/drugpure/rac_ml_4902750670341/?rafcid=wsc_i_is_1023124763673215282,0
58,共立食品 素焼きアーモンド 徳用 200g×12袋入 メーカー 問屋直送｜ 送料無料 お菓子 おつまみ ナッツ ビタミンE 鉄 食物繊維,8097,のぞみマーケット楽天市場店,nozomi-market:10092902,https://item.rakuten.co.jp/nozomi-market/a376-39-t/?rafcid=wsc_i_is_1023124763673215282,0
59,【ふるさと納税】 ブルーベリーアイスキャンデー80ml×20本 アイスクリーム アイスキャンディー 人気 フルーツアイス アイスセット 詰め合わせ スイーツ ジェラート 久保田食品 高知県 南国市,19000,高知県南国市,f392049-nankoku:10000401,https://item.rakuten.co.jp/f392049-nankoku/kb033/?rafcid=wsc_i_is_1023124763673215282,0
60,ノースカラーズ 純国産 無添加ポテトチップス 柚子 53g×24袋,7097,ベジタブルハート,vegetable-heart:10013886,https://item.rakuten.co.jp/vegetable-heart/56625924/?rafcid=wsc_i_is_1023124763673215282,0
61,ジャック製菓 スクラッチお宝くじ 100個+当たり交換分【送料無料】,1836,N丁目薬品,n-yakuhin:10009795,https://item.rakuten.co.jp/n-yakuhin/4973887810313-100nki/?rafcid=wsc_i_is_1023124763673215282,0
62,北川半兵衛商店 宇治の茶菓撰 2262-044 関連：(送料無料 通販 グッズ 商品 便利 父の日 母の日 クリスマス 結婚 プレゼント)新築祝い 暑中御見舞 友人 体育の日 三回忌 お歳暮 贈答品 法事 お中元 花見,10400,創造生活館,ssk-1:18973260,https://item.rakuten.co.jp/ssk-1/asve-168221_04-/?rafcid=wsc_i_is_1023124763673215282,0
63,【送料無料】ラ・フランスゼリー　80g×12個入　【JAてんどうフーズ】（山形県産 ラ・フランス使用）　【smtb-k】【ky】-000008,3600,ナデシコの森,smilehouse:10024056,https://item.rakuten.co.jp/smilehouse/g225/?rafcid=wsc_i_is_1023124763673215282,0
64,Dulcefina Chocolate and Sweets German Fine Drops Sanded Coffee Candy Tin 200gr (Kaffeegeschmack) (8 pcs),17504,Glomarket,glomarket:11695605,https://item.rakuten.co.jp/glomarket/11695605/?rafcid=wsc_i_is_1023124763673215282,0
65,【ふるさと納税】【3ヵ月に1回お届け】JAふらの ポテトチップス 【ふらのっち】うすしお＆コンソメ各12袋 計24袋 ふらの農業協同組合(南富良野町) 芋 菓子 スナック じゃがいも お菓子 ポテチ 定期便,27000,北海道南富良野町,f014621-minamifurano:10000227,https://item.rakuten.co.jp/f014621-minamifurano/52300219/?rafcid=wsc_i_is_1023124763673215282,0
66,桜井食品 お米のホットケーキミックス 200g×20袋入×(2ケース)｜ 送料無料 ホットケーキ ホットケーキミックス粉 菓子材料,11113,飲料 食品専門店 味園サポート,misono-support:10169677,https://item.rakuten.co.jp/misono-support/a558-10-2/?rafcid=wsc_i_is_1023124763673215282,0
67,【ポイント5倍】マクミランアリス ガトーセレクション【出産内祝い 内祝い お祝い お祝い返し ギフト】【出産祝い お返し 返礼ギフト 結婚内祝い 新築内祝い 快気祝い 引越内祝い】【スイーツ 不思議の国のアリス お菓子 焼き菓子 人気】【送料無料 送料込み】,3580,内祝いギフト専門店コウノトリ,averl:10008176,https://item.rakuten.co.jp/averl/702032_ss/?rafcid=wsc_i_is_1023124763673215282,0
68,Z-183-P ワントーンパック 小 スモーキーピンク 500枚 福重 ふくじゅう,4907,業務用製菓材料のスイートキッチン,kashizairyo:10109252,https://item.rakuten.co.jp/kashizairyo/g6586-500/?rafcid=wsc_i_is_1023124763673215282,0
69,香典返し お供え 御供 仏事 弔事 法要 法事 [ ヴァッフェル8枚入 W-10HB ]お返し 返礼 返礼品 粗品 粗供養 満中陰志 御霊前 命日 一周忌 三回忌 49日 四十九日 志 偲草 贈答用,1954,香典法要お返し専門ギフトメモリー,funeral-gift:10029606,https://item.rakuten.co.jp/funeral-gift/apd-4197-051/?rafcid=wsc_i_is_1023124763673215282,0
70,BEER NUTS Original Peanuts 12 oz. Can - Sweet and Salty,4543,Glomarket,glomarket:10964229,https://item.rakuten.co.jp/glomarket/10964229/?rafcid=wsc_i_is_1023124763673215282,0
71,【ふるさと納税】変わりあられ詰合せ【1496989】,21000,岐阜県羽島市,f212091-hashima:10000953,https://item.rakuten.co.jp/f212091-hashima/1496989/?rafcid=wsc_i_is_1023124763673215282,0
72,"Ferrero Rocher, プレミアムグルメミルクチョコレートヘーゼルナッツ、ギフト用個別包装キャンディー、7.9オンス、18個 Ferrero Rocher, Premium Gourmet Milk Chocolate Hazelnut, Individually Wrapped Candy for Gifting, 7.9 oz, 18 Count",7668,Glomarket,glomarket:10116655,https://item.rakuten.co.jp/glomarket/10116655/?rafcid=wsc_i_is_1023124763673215282,0
73,"【アメリカフェア】チーズイットクラッカー チェダー 3ポンド Cheez-It Crackers, Cheddar, 3 lbs 【お取り寄せ商品】【合わせて買いたい】【アメリカコストコ品】",3733,Costopa,womensfitness:10027630,https://item.rakuten.co.jp/womensfitness/kl-00286/?rafcid=wsc_i_is_1023124763673215282,0
74,華優雅 えびせんギフト EYG-ER B143-041 ラッピング無料 のし無料 メッセージカード無料 せんべい 和菓子 ギフト 詰め合わせ ギフトセット 内祝い お取り寄せ ご挨拶 お中元 お歳暮 出産内祝 結婚内祝 出産祝い 結婚祝い 快気祝 御礼 御祝い 贈答用 引き出物 贈り物 短冊,3240,ファッションPetit＆ギフト,petitcaprice:10016216,https://item.rakuten.co.jp/petitcaprice/te-md-ct-gc137-050/?rafcid=wsc_i_is_1023124763673215282,0
75,天然水おかき おもちのきらめき TK-20S,2916,レインボーやまむら,re-yamamura:10172448,https://item.rakuten.co.jp/re-yamamura/33000023/?rafcid=wsc_i_is_1023124763673215282,0
76,【ギフト包装・のし紙無料】スティックケーキギフト 12個入 SC12(A3),2020,トキワカメラ,tokiwacamera:10268692,https://item.rakuten.co.jp/tokiwacamera/25035-c070tft/?rafcid=wsc_i_is_1023124763673215282,0
77,送料無料 送料込 ひねり揚げせんひねりんぽん TH-10 ギフトセット 内祝い 出産内祝い 結婚内祝い 法要 お歳暮 御歳暮 七五三内祝 香典返し 粗供養 お供え 快気祝い 快気内祝い,1465,ギフトハウス　AGコンシェル,autumn1:10281351,https://item.rakuten.co.jp/autumn1/smk6026-01/?rafcid=wsc_i_is_1023124763673215282,0
78,パイオニア企画 白神こだま酵母ドライG 200g×5個 送料無料,12980,エアリーコンタクト,airycl:10005624,https://item.rakuten.co.jp/airycl/r_003664/?rafcid=wsc_i_is_1023124763673215282,0
79,Vチェック　しそ入り干し梅　18g×8個セット［お菓子　梅］,1365,Vドラッグ　楽天市場店,v-drug:10125802,https://item.rakuten.co.jp/v-drug/0270030_4571390580985x8/?rafcid=wsc_i_is_1023124763673215282,0
80,フレック）うらごし さつまいも　400g,1470,マカリロサンキッチン,makariro-sankitchen:10000592,https://item.rakuten.co.jp/makariro-sankitchen/743300085/?rafcid=wsc_i_is_1023124763673215282,0
81,【送料無料！】 ポテトチップス スナック菓子 プリングルズ　スパイシーチキン　95g×24個　8886467128899*24,6480,ドラッグフォーユーネットショップ,fukuei:10095103,https://item.rakuten.co.jp/fukuei/708-8899-024/?rafcid=wsc_i_is_1023124763673215282,0
82,【ポイント5倍】アンドスイーツセレクション スイーツギフトセット【結婚内祝い 新築内祝い 入学内祝い 内祝いギフト 内祝い お祝い プレゼント ギフト 出産祝い お返し 快気祝 快気内祝い 御挨拶】【御歳暮 お歳暮 寒中御見舞】【送料無料 送料込み】,1956,内祝いギフト専門店AGERU,ageru:10005504,https://item.rakuten.co.jp/ageru/705279_ss4/?rafcid=wsc_i_is_1023124763673215282,0
83,MONIN(モナン) バニラ シュガーフリー シロップ(700ml)【モナン】,2727,楽天24,rakuten24:11327491,https://item.rakuten.co.jp/rakuten24/3052911639623/?rafcid=wsc_i_is_1023124763673215282,0
84,EL Fudge ダブルスタッフサンドイッチクッキー 12オンス - 2パック E.L. Fudge Double Stuffed Sandwich Cookies 12oz - 2 packs,6318,Glomarket,glomarket:10037619,https://item.rakuten.co.jp/glomarket/10037619/?rafcid=wsc_i_is_1023124763673215282,0
