順位,商品名,価格,店舗名,商品コード,itemUrl,レビュー数
165,横浜中華街　中国お菓子　サンザシスティック　万利果山査条　200g、不含任何添加剤！　中華菓子、中華おやつ、中華定番の駄菓子♪,259,紹興酒・中華・和・食の東方新世代,shoukoushu:10003698,https://item.rakuten.co.jp/shoukoushu/1500306/?rafcid=wsc_i_is_1023124763673215282,0
166,【送料無料・包装無料・のし無料】銀座千疋屋 銀座フルーツジュレ PGS-433(A4),6710,トキワカメラ,tokiwacamera:10269044,https://item.rakuten.co.jp/tokiwacamera/25007-c063tfm/?rafcid=wsc_i_is_1023124763673215282,0
167,ワインリッヒ　ジントニック　チョコレート　100g　120セット,74227,ライフ＆ビューティ,l-and-b:14833929,https://item.rakuten.co.jp/l-and-b/1685064/?rafcid=wsc_i_is_1023124763673215282,0
168,ドーナツ型チーズケーキ ハピチリング 4種ギフトセットA（いちご・抹茶・チョコ・ホワイト）グルテンフリー 冷凍 iHug Cheeseドーナッツ おしゃれ お菓子 お取り寄せ スイーツ ギフト プレゼント 贈り物 贈答 お中元 お歳暮 お祝い 内祝い 手土産 アイハグチーズ,3480,美味逸品,bimi-ippin:10002610,https://item.rakuten.co.jp/bimi-ippin/ihug1010-1/?rafcid=wsc_i_is_1023124763673215282,0
169,富士山 お土産 送料無料 富士山倶楽部 20枚入×16箱 山梨 おみやげ 洋菓子 焼き菓子 クッキー チョコレート 景品 プレゼント 手みやげ ケース販売 まとめ買い,17000,ワイエムカンパニー,ym-company:10000615,https://item.rakuten.co.jp/ym-company/25945-16/?rafcid=wsc_i_is_1023124763673215282,0
170,プチギフト あられ お菓子【 ずわい蟹あられ 】退職 挨拶 おしゃれ お礼 お返し 感謝 プレゼント 500円,562,結婚式・プチギフト店　まんぞく屋,tongari-r:10008101,https://item.rakuten.co.jp/tongari-r/mori-f35-223/?rafcid=wsc_i_is_1023124763673215282,0
171,"【最大500円OFFクーポン有】グレートバリュー ピーナッツバター サンドイッチクッキー 454g 36枚入 Great Value Peanut Butter Sandwich Cookies, 16 oz, 36 Count 【お取り寄せ商品】",1306,アメリカお菓子のYummy USA,yummyusa:10002733,https://item.rakuten.co.jp/yummyusa/wm-12596/?rafcid=wsc_i_is_1023124763673215282,0
172,"ACT II、電子レンジ用ポップコーン、バターケトルコーン、2.75オンス バッグ、3 カラット ACT II, Microwave Popcorn, Buttery Kettle Corn, 2.75-oz. Bags, 3 Ct",2684,Glomarket,glomarket:10150649,https://item.rakuten.co.jp/glomarket/10150649/?rafcid=wsc_i_is_1023124763673215282,0
173,Chocolove Xoxo Dark Chocolate Raspberry Bar 3.1 Ounce (Pack of 12) Chocolove Xoxo Dark Chocolate Raspberry Bar 3.1 Ounce (Pack of 12),15213,Glomarket,glomarket:10117359,https://item.rakuten.co.jp/glomarket/10117359/?rafcid=wsc_i_is_1023124763673215282,0
174,川口製菓 瞳はブルーベリー のど飴 83g×3個 [ゆうパケット・送料無料],990,福薬本舗　健康館,fukuyakuhonpo:10066091,https://item.rakuten.co.jp/fukuyakuhonpo/4901380180015-3/?rafcid=wsc_i_is_1023124763673215282,0
175,【5セット】 ノースリーフ 北海道ギフトセット(恋の街さっぽろ・じゃがバタークッキー・北海道ミルククリームサンド・ポテっとチーズ・牛乳サブレ) FUJI62432X5 ギフト お歳暮 お中元 お祝い 見舞い | 関連単語 お年賀 御歳暮 御中元 初節句 七五三 入園 入学 卒業,23700,創造生活館,ssk-1:19941167,https://item.rakuten.co.jp/ssk-1/asve-4589453222888_03-/?rafcid=wsc_i_is_1023124763673215282,0
176,信州伊那 つぐや 国産たまごを使った たまごロールケーキ プレーン 送料無料 法事のお返し 香典返し お菓子 返礼品 法事 法事返礼品 お供え お菓子 お祝い返し お菓子 粗供養 品 香典返し 品物 楽天 一周忌お返し 内祝い 快気祝 お供えお返し スイーツ 常温 菓子折り 洋菓子,2300,マユギフト　楽天市場店,mayugift:10000658,https://item.rakuten.co.jp/mayugift/100176/?rafcid=wsc_i_is_1023124763673215282,0
177,まるか食品　のり天瀬戸内すだち味　27g(10×6),10344,ELMONO（家具 ラグ カーペット）,elmon0:10466434,https://item.rakuten.co.jp/elmon0/ba87-1625284/?rafcid=wsc_i_is_1023124763673215282,0
178,"ハルディラム チャナ ジョー ガラム (スパイシー ブラック グラム) - 7.06 オンス、200g。(2個入り) Haldiram's Haldiram Chana Jor Garam (Spicy Black Gram) - 7.06oz., 200g. (Pack of 2)",7793,Glomarket,glomarket:11310779,https://item.rakuten.co.jp/glomarket/11310779/?rafcid=wsc_i_is_1023124763673215282,0
179,ギフト ティサージュ 彩りアソート M TIA-23 内祝 御礼 御祝 プレゼント お土産,2700,まるひろオンラインショップ,maruhiro-dep:10071794,https://item.rakuten.co.jp/maruhiro-dep/68400045/?rafcid=wsc_i_is_1023124763673215282,0
180,【ふるさと納税】 せんべいセット（ご自宅用）【真・特上】25枚+20本+440グラム　醤油の町「銚子・福屋」の炭火焼手焼きせんべい／包装なし｜和菓子 米菓 煎餅 10種,24000,千葉県銚子市,f122025-choshi:10000307,https://item.rakuten.co.jp/f122025-choshi/17119-30045963/?rafcid=wsc_i_is_1023124763673215282,0
181,(地域限定送料無料)グリコ クラッツ＜枝豆＞【20コ入り】さんきゅーマーチ(4901005185807sx20k),5400,さんきゅーマーチ,39march:10008585,https://item.rakuten.co.jp/39march/4901005185807sx20k/?rafcid=wsc_i_is_1023124763673215282,0
182,仙臺まころん 詰合せ 45g×5袋入り 20箱入りセット 化粧箱入り 贈答 ギフト 落花生 厳選 竹鶏たまご 白石蔵王 伝承 郷土 宮城 伊藤食品工業所,27400,食材王国みやぎプラザ,miyagi-s-iroha:10000136,https://item.rakuten.co.jp/miyagi-s-iroha/r030is-0005/?rafcid=wsc_i_is_1023124763673215282,0
183,奥賽山査餅【10点セット】サンザシのお菓子 歯ごたえ 新鮮なさんざしを使用 無添加 小分け 138g×10点,2490,東洋ツバメの巣,yanwo:10002628,https://item.rakuten.co.jp/yanwo/26szb-yw-10-os/?rafcid=wsc_i_is_1023124763673215282,0
184,内祝い お返し 送料無料 スイーツ 和菓子 ギフト あられ おかき 天然水おかき まろやかさん セット 詰め合わせ 米菓 ふっくら 個包装 食品 食べ物 出産内祝い 結婚内祝い 結婚祝い 出産祝い 引き出物 香典返し 快気祝い お祝い返し 引越し 挨拶 お礼 TM-15S,1728,ハローベビー 内祝い お返しギフト,happy-hellobaby:10230301,https://item.rakuten.co.jp/happy-hellobaby/tcr167-01/?rafcid=wsc_i_is_1023124763673215282,0
185,モンシャルール カフェ レーズンサンド・コーヒーセット RS-15,2160,レインボーやまむら,re-yamamura:10158071,https://item.rakuten.co.jp/re-yamamura/37100266/?rafcid=wsc_i_is_1023124763673215282,0
186,金澤兼六製菓 兼六の華 海老カレー煎餅・黒ごま入り玄米煎餅・海老胡椒煎餅×各6、えびまめ花煎餅・つぶやきサラダ煎餅・金澤カレー煎餅×各3 B1045566 食品 佃煮 詰合せ セット ギフト | 関連単語 お歳暮 レトルト 老舗 カツオ 鰹 昆布 だし 御歳暮,4070,創造生活館,ssk-1:19836083,https://item.rakuten.co.jp/ssk-1/asve-4932123119337_06-/?rafcid=wsc_i_is_1023124763673215282,0
187,送料無料 送料込 ドトールコーヒー＆スイーツバラエティ FADH-BEY 内祝い お返し ギフトセット 出産内祝い 結婚内祝い 御祝 お供え 御供 お歳暮 御歳暮 七五三内祝 香典返し 粗供養 快気祝い 快気内祝い,2349,AGコーポレーション,agcoop:10249411,https://item.rakuten.co.jp/agcoop/s2610-033/?rafcid=wsc_i_is_1023124763673215282,0
188,アイスボックスクッキー生地 ノーカットタイプ 黒ゴマ 3本 七洋製作所 クッキー生地,13615,業務用製菓材料のスイートキッチン,kashizairyo:10109864,https://item.rakuten.co.jp/kashizairyo/63773/?rafcid=wsc_i_is_1023124763673215282,0
189,【ギフト包装・のし紙無料】バウムクーヘン(木箱入) KB1-10G(A5),900,トキワダイレクト,digital7:10255386,https://item.rakuten.co.jp/digital7/250404-037sdt/?rafcid=wsc_i_is_1023124763673215282,0
190,【送料無料】ノーベル製菓 くちどけまんまるラムネ 80g ×4袋 袋タイプ【ラムネ】,1120,おやつくん　お菓子の専門店,oyatsukun:10007009,https://item.rakuten.co.jp/oyatsukun/4902124681775-4m/?rafcid=wsc_i_is_1023124763673215282,0
191,モロゾフ ファヤージュ MO-1794 内祝い お返し ギフトセット 出産内祝い 結婚内祝い 御祝 お供え 御供 お歳暮 御歳暮 七五三内祝 香典返し 粗供養 快気祝い 快気内祝い,681,ギフトハウス　AGコンシェル,autumn1:10273453,https://item.rakuten.co.jp/autumn1/001-b012/?rafcid=wsc_i_is_1023124763673215282,0
192,【即納】栗あん 人形焼 60個 (20個入り×3袋) 訳あり わけあり 無選別 お徳用 個包装 スイーツ 和菓子 こしあん お茶菓子 くりあん にんぎょうやき プレゼント ギフト ハロウィン 文化祭 お歳暮 運動会,2480,ワイワイプラザ,waiwaiplaza:10014099,https://item.rakuten.co.jp/waiwaiplaza/20001056/?rafcid=wsc_i_is_1023124763673215282,0
193,"4.5 オンス (4 個パック)、Valley Lahvosh ハーツ クラッカー 4.5 オンス (4 個パック) 4.5 Ounce (Pack of 4), Valley Lahvosh Hearts Crackers 4.5 oz (Pack of 4)",8092,Glomarket,glomarket:10116847,https://item.rakuten.co.jp/glomarket/10116847/?rafcid=wsc_i_is_1023124763673215282,0
194,味覚糖　氷あめソーダ　10個セット　8LINK,3060,Dream Store78,dreamstore78:10024239,https://item.rakuten.co.jp/dreamstore78/4902750945104-10/?rafcid=wsc_i_is_1023124763673215282,0
195,栗饅頭10個入　結婚祝い,2800,手づくり和菓子翁屋　楽天市場店,okinaya-r:10001733,https://item.rakuten.co.jp/okinaya-r/kekon-kuriman-10/?rafcid=wsc_i_is_1023124763673215282,0
196,ソーキ ポリポリ納豆こんぶ 85g×1袋メール便/【栄養補助食 ビタミンD 納豆 昆布 おやつ おつまみ】,756,プラスイン,ju-suya:10007216,https://item.rakuten.co.jp/ju-suya/10007216/?rafcid=wsc_i_is_1023124763673215282,0
197,食べたときのサクサク・ネバネバ感が最高！　オクラチップ　300g入り【オクラチップ300g】,2680,オーケーギフト ナッツデイ,nutsday:10000127,https://item.rakuten.co.jp/nutsday/y-okr0300/?rafcid=wsc_i_is_1023124763673215282,0
198,河内駿河屋 わらび餅とくず餅の食べくらべ WK-10 4198-039 ラッピング無料 のし無料 わらびもち きなこ 和三盆 和菓子 詰め合わせ ギフト 誕生日 プレゼント 敬老の日 祖父 祖母 お中元 暑中見舞い 出産内祝い 結婚内祝い 御礼 香典返し お供え 仏事 法要 法事 B51,2181,ファッションPetit＆ギフト,petitcaprice:10016246,https://item.rakuten.co.jp/petitcaprice/ap-ska-ds-6212-033/?rafcid=wsc_i_is_1023124763673215282,0
199,Taali NEW スイート シナモン バニラ ポップ スイレン ポップ (6 再封可能な袋) 追加のプロテインブーストで甘党を満足させましょう 外出先でのスナック ミルクと一緒に朝シリアルとしてどうぞ (2オンス袋) Taali NEW Sweet Cinnamon Vanilla Popped,15308,Glomarket,glomarket:10060988,https://item.rakuten.co.jp/glomarket/10060988/?rafcid=wsc_i_is_1023124763673215282,0
200,"Terra 野菜チップス、海塩、6.8 オンス Terra Vegetable Chips, Sea Salt, 6.8 oz.",3009,Glomarket,glomarket:10265194,https://item.rakuten.co.jp/glomarket/10265194/?rafcid=wsc_i_is_1023124763673215282,0
201,大阪京菓 ZRx植垣米菓　88G 六甲花吹雪×12個【xeco】【エコ配 送料無料 （沖縄県配送不可 時間指定と夜間お届け不可）】,4667,大阪京菓楽天市場店,osaka:10353315,https://item.rakuten.co.jp/osaka/4901016021705xecos5/?rafcid=wsc_i_is_1023124763673215282,0
202,"【最大1000円OFFクーポン】【アメリカウォルマート品】ギラデリ アルティメット チョコレート プレミアム ブラウニー ミックス 約538g ボックス GHIRARDELLI Ultimate Chocolate Premium Brownie Mix, 19 oz Box 【お取り寄せ商品】【合わせて買いたい】",1612,カリフォルニアスマイル,cmga:10009055,https://item.rakuten.co.jp/cmga/wm-03488/?rafcid=wsc_i_is_1023124763673215282,0
203,【お買上特典】とうもろこしでつくったパフスナック・塩味 55g【サンコー】,240,健康サポート専門店,kenkousupport:10053713,https://item.rakuten.co.jp/kenkousupport/0038-0-32718/?rafcid=wsc_i_is_1023124763673215282,0
204,"36 Count (Pack of 1), Mexican Candy Lollipops Mix Assortment (36 Count) Variety Pack of Sweet, Sour & Spicy, Includes Rebanaditas, Vero Mango, De La Rosa, Pipeno, Pina Loca, El Azteca Chileta, La Vaquita b",5472,Glomarket,glomarket:11695672,https://item.rakuten.co.jp/glomarket/11695672/?rafcid=wsc_i_is_1023124763673215282,0
205,モチド 巨峰(45g×80セット)【UHA味覚糖】,13651,楽天24,rakuten24:11365423,https://item.rakuten.co.jp/rakuten24/622967/?rafcid=wsc_i_is_1023124763673215282,0
206,瀬戸内産レモンケーキ 10個入り　阿里弥（LCG）｜ 菓子 お菓子 おやつ ギフト セット プレゼント 贈り物 愛媛 愛媛県 お土産 松山,1880,スーパーフジの通販 FUJI netshop,the-fuji:10225742,https://item.rakuten.co.jp/the-fuji/stk-851-79119/?rafcid=wsc_i_is_1023124763673215282,0
207,オーガニックポテトチップス(シーソルト)/85g【若翔】 Golden State Organic SEA SALT,505,健康ストア　健友館,kenyu-kan:10019885,https://item.rakuten.co.jp/kenyu-kan/009586/?rafcid=wsc_i_is_1023124763673215282,0
208,イシハラ　USピスタチオカーネル　1kg　【菓子材料・パン材料・生・無塩・ナッツ・アメリカ産ピスタチオ・トッピング】,7965,パンの材料屋さん！！ぶーらんじぇ,boulan-:10001152,https://item.rakuten.co.jp/boulan-/10001152/?rafcid=wsc_i_is_1023124763673215282,0
209,【グルテンフリー】【無添加】櫛田養鶏場の名古屋コーチン米粉フィナンシェ 12個入り 名古屋コーチン 冷凍 愛知 おみやげ お取り寄せスイーツ スイーツ 手土産 個包装 洋菓子名古屋コーチンの卵,4980,櫛田養鶏場　楽天市場店,kushida-yo-kei:10000092,https://item.rakuten.co.jp/kushida-yo-kei/10000087/?rafcid=wsc_i_is_1023124763673215282,0
210,"ニューヨークスタイル ガーリックベーグルクリスプ、7.2オンス (3個パック) New York Style Garlic Bagel Crisps, 7.2 oz (Pack of 3)",7178,Glomarket,glomarket:10199231,https://item.rakuten.co.jp/glomarket/10199231/?rafcid=wsc_i_is_1023124763673215282,0
211,FirstChoiceCandy Rock キャンディ クリスタル 2 ポンド バルクバッグ (ブルー ラズベリー) FirstChoiceCandy Rock Candy Crystals 2 Pound Bulk Bag (Blue Raspberry),7070,Glomarket,glomarket:10392263,https://item.rakuten.co.jp/glomarket/10392263/?rafcid=wsc_i_is_1023124763673215282,0
212,【ふるさと納税】黒で四角で生銅鑼焼で。 6個入り スイーツ どらやき どら焼き おやつ お菓子 グルメ お取り寄せ お中元 お歳暮 ギフト 小松市 石川県 008036【お菓子処マルニシ】,8000,石川県小松市,f172031-komatsu:10001654,https://item.rakuten.co.jp/f172031-komatsu/8036/?rafcid=wsc_i_is_1023124763673215282,0
213,【ふるさと納税】お菓子 お土産 カスドース・カステラ・ポルトガル煎餅詰め合わせ＜A＞ 12回 定期便 [湖月堂老舗 長崎県 平戸市 hr42bgy390021] 銘菓 スイーツ 和菓子 長崎 南蛮菓子 揚げ菓子 セット,237600,長崎県平戸市,f422070-hirado:10002038,https://item.rakuten.co.jp/f422070-hirado/hr42bgy390021/?rafcid=wsc_i_is_1023124763673215282,0
214,大阪京菓 ZRxエムディエッチ　50G ハッピーポップコーン　抹茶ラテ＆シーソルト×240個【xra5】【送料無料（沖縄は別途送料）】,65957,大阪京菓楽天市場店,osaka:10375940,https://item.rakuten.co.jp/osaka/4977856213495xra5/?rafcid=wsc_i_is_1023124763673215282,0
215,アイスとミルクシュー 乳蔵 ギフト プレゼント 贈り物 【代引不可】,4104,壱番館STORE,ichibankanshop:11276441,https://item.rakuten.co.jp/ichibankanshop/apde-4821-599/?rafcid=wsc_i_is_1023124763673215282,0
216,【ポイント5倍】あまおう苺バウムクーヘン＆プチフィナンシェ　ギフトボックス【内祝い お返し 結婚内祝い 出産内祝い ギフトセット 人気 スイーツ スイーツギフト スイーツセット 初節句内祝】【御歳暮 お歳暮 夏ギフト】【送料無料 送料込み】,5090,出産内祝い専門店　アドヴァン,gs-advan:10001927,https://item.rakuten.co.jp/gs-advan/550a0304/?rafcid=wsc_i_is_1023124763673215282,0
217,キシリトールストーン キャンディ レモン味 20g,455,くらしのカタログ,kusuri-hagakure:10233903,https://item.rakuten.co.jp/kusuri-hagakure/1758976553-1-a/?rafcid=wsc_i_is_1023124763673215282,0
218,キューブシューセット 5個【代引不可】,4407,QUOLI,q-uoli:10139283,https://item.rakuten.co.jp/q-uoli/qr9261653924/?rafcid=wsc_i_is_1023124763673215282,0
219,【ふるさと納税】ナチュランド特選クッキー 8種詰め合わせ【1616126】,11000,東京都多摩市,f132241-tama:10000043,https://item.rakuten.co.jp/f132241-tama/1616126/?rafcid=wsc_i_is_1023124763673215282,0
220,☆華優雅 えびせんギフト L8113027,2090,カー用品卸問屋　ニューフロンテア,nf:12027936,https://item.rakuten.co.jp/nf/ao-4904963425091/?rafcid=wsc_i_is_1023124763673215282,0
221,アリサン　有機レ−ズン　250g　×12個セット,6699,ビーライフショップ,blife:10059912,https://item.rakuten.co.jp/blife/al-f20a-12/?rafcid=wsc_i_is_1023124763673215282,0
222,oishiku tanosii ひとときさん TO-25 内祝い お返し ギフトセット 出産内祝い 結婚内祝い お供え 御供 お歳暮 御歳暮 七五三内祝 香典返し 粗供養 快気祝い 快気内祝い,1620,ギフトハウス　AGコンシェル,autumn1:10269723,https://item.rakuten.co.jp/autumn1/2815-010/?rafcid=wsc_i_is_1023124763673215282,0
223,送料無料【サンコー　ミニやさいスナック 10g×4　を15個セット】※お取り寄せ,6599,珈琲工房リバティ楽天市場店,liberty55:10001288,https://item.rakuten.co.jp/liberty55/4973728910165/?rafcid=wsc_i_is_1023124763673215282,0
224,【送料無料】金澤兼六製菓　兼六の華　KRN−30R　KRN−30R【ギフト館】,3429,イージャパンアンドカンパニーズ,japan-ds:12196726,https://item.rakuten.co.jp/japan-ds/2025-apd-4808/?rafcid=wsc_i_is_1023124763673215282,0
225,【ふるさと納税】生食パン専門店『Pan wa Pan』 の ラスク（ジェノベーゼ）10袋 手土産 ギフト スイーツ 焼菓子 お菓子,13000,秋田県秋田市,f052019-akita:10004694,https://item.rakuten.co.jp/f052019-akita/15_atb-021001/?rafcid=wsc_i_is_1023124763673215282,0
226,大阪京菓 ZRx名糖産業　52G 生姜のど湯飴×60個【xecoa5】【エコ配 送料無料 （沖縄県配送不可 時間指定と夜間お届け不可）】,9982,大阪京菓楽天市場店,osaka:10367384,https://item.rakuten.co.jp/osaka/4902757261207xecoa5/?rafcid=wsc_i_is_1023124763673215282,0
227,★まとめ買い★　なとり　JPフィッシュアーモンド　×10個【イージャパンモール】,1465,イージャパンアンドカンパニーズ,japan-ds:10907600,https://item.rakuten.co.jp/japan-ds/ms-010-4902181081174/?rafcid=wsc_i_is_1023124763673215282,0
228,ハロウィンお菓子8種 100個 まとめ買い 個包装 駄菓子 スナック菓子 おやつ 詰め合わせ パック 常温保存 ばらまき 配布 粗品 贈り物 記念品 景品 ノベルティ 賞品 御礼 販促 プレゼント プチギフト 業務用 大量 ケース販売,25000,IPPIN-MARKET,ippin-market1:10001920,https://item.rakuten.co.jp/ippin-market1/hlw-ip2477505/?rafcid=wsc_i_is_1023124763673215282,0
229,【ふるさと納税】【隔月定期便】 Bistrot Abbesses(ビストロアベス)　チーズテリーヌ (500g/本) × 隔月6回【全6回配送】北海道 スイーツ（ ふるさと納税 チーズ テリーヌ チーズテリーヌ チーズケーキ スイーツ 北海道 ふるさと納税 お菓子 洋菓子 菓子 ちーずけーき ）,96000,北海道別海町,f016918-betsukai:10001347,https://item.rakuten.co.jp/f016918-betsukai/be084-072a001-3/?rafcid=wsc_i_is_1023124763673215282,0
230,"Sheila G's, Brownie Brittle Dark Chocolate, 5 oz",3110,Glomarket,glomarket:11689117,https://item.rakuten.co.jp/glomarket/11689117/?rafcid=wsc_i_is_1023124763673215282,0
231,井崎商店 海老とチーズ おかき 200g×1袋,1306,みぞたオンラインストア楽天市場店,mizota:10022470,https://item.rakuten.co.jp/mizota/4513796502017-1/?rafcid=wsc_i_is_1023124763673215282,0
232,【NAMEGATA米こトマトバウムクーヘン】グルテンフリー 米粉 洋菓子 焼き菓子 小麦粉不使用 ギフト スイーツ,1850,なめがた米こバウムクーヘン,namegatakomeko:10000019,https://item.rakuten.co.jp/namegatakomeko/17tomato/?rafcid=wsc_i_is_1023124763673215282,0
233,大阪京菓 ZRxなとり　41G 北海道加工ソフトいか燻製×90個【x】【送料無料（沖縄は別途送料）】,37130,大阪京菓楽天市場店,osaka:10352751,https://item.rakuten.co.jp/osaka/4902181101186xs5/?rafcid=wsc_i_is_1023124763673215282,0
234,Trolli(トローリ) グミキャンディ サワーコーラクラブ 100g×12個セット 00120013【送料無料】,4981,LifeUp,lifeup1:10264425,https://item.rakuten.co.jp/lifeup1/t3ab-2242649/?rafcid=wsc_i_is_1023124763673215282,0
235,かりんとうギフト MKT-20R,1080,ギフトマン　楽天市場店,giftman:10323057,https://item.rakuten.co.jp/giftman/23r7609-020/?rafcid=wsc_i_is_1023124763673215282,0
236,[公式] ジョンノ★★ チーズハットグ3本+ポテトハットグ3本+おまけ1本=合計7本★★3+3+1【おまけつき】 ジョンノハットグ 元祖ジョンノポテトモッツァレッラチーズハットグ 110g〜120g　韓国料理 韓国食品 餃子 ぎょうざ 惣菜 詰め合わせ お惣菜 母の日 おかずセット,2432,ジョンノタウン,jongno-cheesehatogu:10000242,https://item.rakuten.co.jp/jongno-cheesehatogu/10003-1/?rafcid=wsc_i_is_1023124763673215282,0
237,☆【5セット】 ドトールコーヒー&どら焼き 詰合せ ドリップコーヒー7g、どら焼き(粒あん、八女抹茶あん)×各3 DR-15X5,5280,カー用品卸問屋　ニューフロンテア,nf:12108272,https://item.rakuten.co.jp/nf/ao-4589453200169/?rafcid=wsc_i_is_1023124763673215282,0
238,大阪京菓 ZRxでん六　120G 海味鮮パック×96個【xra5】【送料無料（沖縄は別途送料）】,36277,大阪京菓楽天市場店,osaka:10365895,https://item.rakuten.co.jp/osaka/4901930145235xra5/?rafcid=wsc_i_is_1023124763673215282,0
239,パーラービーズ 単色 マゼンタ,498,即日出荷のリオストア,riostore13:10004327,https://item.rakuten.co.jp/riostore13/mail-100g-b-kawada-rd04-01p-02/?rafcid=wsc_i_is_1023124763673215282,0
240,【送料無料】 湖池屋 コイケヤ スリムバッグ スティックすっぱムーチョ さっぱり梅味 37g×6袋入 ※北海道800円・東北400円の別途送料加算,1331,アットコンビニ楽天市場店,at-cvs:10035868,https://item.rakuten.co.jp/at-cvs/4901335140446/?rafcid=wsc_i_is_1023124763673215282,0
241,Imagine Organic Creamy Sweet Pea Soup 32 oz,3000,Glomarket,glomarket:10049199,https://item.rakuten.co.jp/glomarket/10049199/?rafcid=wsc_i_is_1023124763673215282,0
242,森永製菓 チョコレートシロップ 200g×40本入｜ 送料無料 ケーキシロップ シロップ お菓子 おやつ 菓子材料,12074,飲料 食品専門店 味園サポート,misono-support:10011461,https://item.rakuten.co.jp/misono-support/b48-48/?rafcid=wsc_i_is_1023124763673215282,0
243,大阪京菓 ZRx高橋製菓　仁の蔵　70G 里の味×12個【xeco】【エコ配 送料無料 （沖縄県配送不可 時間指定と夜間お届け不可）】,5270,大阪京菓楽天市場店,osaka:10332325,https://item.rakuten.co.jp/osaka/4944034323000xecoa4/?rafcid=wsc_i_is_1023124763673215282,0
244,Funny- Frisch Flippies Classic Erdnussflips (ピーナッツ パフ) バッグ 250g Funny Frisch Funny- Frisch Flippies Classic Erdnussflips (Peanut Puffs) Bag 250g,5005,Glomarket,glomarket:10062075,https://item.rakuten.co.jp/glomarket/10062075/?rafcid=wsc_i_is_1023124763673215282,0
245,【ギフト】ロディ カフェタイムセット G-A 【北海道・沖縄・離島配送不可】,653,フジックス,fujix:12301887,https://item.rakuten.co.jp/fujix/g250398010/?rafcid=wsc_i_is_1023124763673215282,0
246,【暮らしラクラク応援セール】回進堂 岩谷堂羊羹 ミニ詰合せ 12個入【軽減税率対象商品】【取り寄せ・返品不可商品】,2990,美-健康ゴルフ,b-kenkougolf:10364935,https://item.rakuten.co.jp/b-kenkougolf/ab-1407621/?rafcid=wsc_i_is_1023124763673215282,0
247,「きつねめん」8枚入り(個包装)箱あり／砂糖菓子 きつね 稲荷 和菓子 珍菓 山形 庄内 鶴岡 特産品 お土産 お取り寄せ,907,庄内観光物産館,shonai-kankobussankan:10001802,https://item.rakuten.co.jp/shonai-kankobussankan/10001802/?rafcid=wsc_i_is_1023124763673215282,0
